{
  "$schema": "../schemas/component.schema.json",
  "name": "Badge",
  "block": "c-badge",
  "layer": "component",
  "status": "stable",
  "since": "0.1.0",
  "description": "A short, non-interactive label for status or category, such as \"Beta\" or \"Paid\".",
  "tags": ["span"],
  "modifiers": [
    {
      "group": "tone",
      "exclusive": true,
      "values": [
        { "name": "primary", "description": "Brand emphasis, e.g. \"New\"." },
        { "name": "success", "description": "Positive status, e.g. \"Active\"." },
        { "name": "warning", "description": "Needs attention, e.g. \"Expiring\"." },
        { "name": "error", "description": "Negative status, e.g. \"Failed\"." },
        { "name": "info", "description": "Neutral information, e.g. \"Draft\"." }
      ]
    }
  ],
  "guidelines": {
    "whenToUse": [
      "Showing the status of an item: Draft, Active, Failed.",
      "A short category or plan label: Beta, Pro."
    ],
    "whenNotToUse": [
      "Anything clickable, removable or filterable: use `c-button` with c-button--sm.",
      "A count on a navigation item: badges here are for status words, not numbers.",
      "A sentence: use body text or an alert."
    ],
    "use": ["Keep badge text to one or two words.", "Group several badges with l-cluster."],
    "avoid": [
      "Making a badge clickable; use c-button--sm instead.",
      "Relying on badge color alone to convey meaning; the text must carry the status."
    ],
    "doDont": [
      {
        "do": {
          "text": "Say the status in words; the tone only supports it.",
          "html": "<div class=\"l-cluster\">\n  <span class=\"c-badge c-badge--error\">Failed</span>\n  <span class=\"c-badge c-badge--success\">Passed</span>\n</div>"
        },
        "dont": {
          "text": "Don't make a badge clickable or invent tones.",
          "html": "<span class=\"c-badge c-badge--danger\">Failed</span>",
          "rule": "unknown-class"
        }
      }
    ],
    "content": [
      "One or two words, sentence case: \"In review\", not \"IN REVIEW\".",
      "Each tone keeps one meaning across the product: error always means something failed."
    ]
  },
  "tokens": ["--badge-background", "--badge-text", "--color-action-primary", "--color-text-on-action"],
  "a11y": ["Color is decorative; the badge text must describe the status on its own."],
  "related": ["l-cluster", "c-card"],
  "examples": ["badge.html"],
  "sources": [
    { "title": "GitLab Pajamas: Badge", "url": "https://design.gitlab.com/components/badge/" },
    { "title": "Atlassian: Badge", "url": "https://atlassian.design/components/badge" },
    {
      "title": "Smart Interface Design Patterns: Badges, chips, tags, pills",
      "url": "https://smart-interface-design-patterns.com/articles/badges-chips-tags-pills/"
    }
  ]
}
