{
  "$schema": "../schemas/component.schema.json",
  "name": "Stack",
  "block": "l-stack",
  "layer": "layout",
  "status": "stable",
  "since": "0.1.0",
  "description": "Vertical flow: adds space between consecutive children, which keep their own width. Bare inline children (links, spans) stack too. The default way to space components vertically.",
  "modifiers": [
    {
      "group": "gap",
      "exclusive": true,
      "values": [
        {
          "name": "sm",
          "description": "Tight spacing (0.5rem), e.g. form-field internals or list items."
        },
        {
          "name": "lg",
          "description": "Loose spacing (2rem), e.g. between page blocks."
        }
      ]
    }
  ],
  "guidelines": {
    "whenToUse": [
      "Anything that flows top to bottom: form fields, paragraphs, a card body, a page column.",
      "Changing rhythm: nest a smaller stack (l-stack--sm) inside a larger one."
    ],
    "whenNotToUse": [
      "Items in a row that wrap: use `l-cluster`.",
      "Two-dimensional layouts: use `l-grid`."
    ],
    "use": [
      "Nest stacks with different gaps to build rhythm."
    ],
    "avoid": [
      "Adding margins to children to fix spacing; change the stack modifier instead."
    ],
    "doDont": [
      {
        "do": {
          "text": "Let the stack own the space between its children.",
          "html": "<div class=\"l-stack\">\n  <h2 class=\"u-margin-0\">Billing</h2>\n  <p class=\"u-margin-0\">Your plan renews on 1 March.</p>\n  <div class=\"l-cluster\">\n    <button type=\"button\" class=\"c-button\">Change plan</button>\n  </div>\n</div>"
        },
        "dont": {
          "text": "Don't fix spacing with margins on the children.",
          "html": "<div class=\"l-stack\">\n  <section class=\"c-card\" style=\"margin-top: 32px\"><p class=\"u-margin-0\">Plan</p></section>\n</div>",
          "rule": "golden-rule"
        }
      },
      {
        "do": {
          "text": "Pick the gap with a modifier.",
          "html": "<div class=\"l-stack l-stack--sm\">\n  <p class=\"u-margin-0\">Line one</p>\n  <p class=\"u-margin-0\">Line two</p>\n</div>"
        },
        "dont": {
          "text": "Don't combine two gap modifiers.",
          "html": "<div class=\"l-stack l-stack--sm l-stack--lg\">\n  <p class=\"u-margin-0\">Line one</p>\n</div>",
          "rule": "exclusive-modifiers"
        }
      }
    ]
  },
  "tokens": [
    "--space-2",
    "--space-4",
    "--space-8"
  ],
  "related": [
    "l-cluster",
    "c-form-field"
  ],
  "examples": [
    "layouts.html"
  ],
  "sources": [
    {
      "title": "Every Layout: The Stack",
      "url": "https://every-layout.dev/layouts/stack/"
    },
    {
      "title": "LogRocket: CSS gap vs margin",
      "url": "https://blog.logrocket.com/css-gap-vs-margin/"
    }
  ]
}
